0,1,2,3,4,5,6,7,8,9
Groupe 0,645 personnages,Groupe 1,421 personnages,Groupe 2,47 personnages,Groupe 3,340 personnages,Groupe 4,83 personnages
Michel Blanc (acteur français),Mike Oldfield,Gandalf,Han Solo (star wars),Tintin (personnage de BD),Barack Obama,Ant-man ,Anne Hidalgo ,Ivan Leplumey (enseignant INSA Rennes),Bernard-Henry Lévy (philosophe imposteur)
Carlos Ghosn,Brigitte Macron,Adibou,Hubert Bonnisseur de la Bath,Mario Bros (perso jeux vidéo),François Hollande,Aquarius ,Général Shepard (Mass Effect),Nicolas Sarkozy,Jacques Chirac
Ton personnage est-il réel ?,4.06,Ton personnage a-t-il un prénom hors du commun ?,1.43,Ton personnage a-t-il des cheveux ?,3.43,Ton personnage vit-il dans un monde imaginaire ?,0.02,Ton personnage est-il réel ?,6.28
Ton personnage est-il un garçon ?,1.0,Ton personnage porte-t-il des chaussures ?,1.43,Ton personnage est-il célèbre  ?,3.19,Ton personnage a-t-il un prénom hors du commun ?,0.01,Ton personnage est-il célèbre  ?,2.42
Ton personnage est-il célèbre  ?,0.78,Ton personnage a-t-il des cheveux ?,1.3,Ton personnage porte-t-il des chaussures ?,3.14,Ton personnage a-t-il plus de 50 ans ?,0.01,Ton personnage a-t-il plus de 35 ans ?,2.36
Ton personnage a-t-il été roi ?,-2.378,Ton personnage est-il réel ?,-4.083,Ton personnage a-t-il été roi ?,-4.908,Ton personnage est-il portugais ?,-0.047,Ton personnage vit-il dans un monde imaginaire ?,-4.686
Ton personnage vit-il dans un monde imaginaire ?,-1.977,Ton personnage a-t-il été roi ?,-1.649,Ton personnage est-il un tueur ?,-4.376,Ton personnage a-t-il joué dans Stargate ?,-0.046,Ton personnage a-t-il été roi ?,-4.623
