Cluster,Medoid,Q0,Q1,Q2,Q3,Q4
1,Joséphine (série TV: Joséphine Ange Gardien),Oui Ton personnage est-il réel ?,Non Ton personnage est-il décédé ?,Non Ton personnage a-t-il été roi ?,Oui Ton personnage est-il français ?,Non Ton personnage est-il français ?,
2,Nicolas Sarkozy,Oui Ton personnage est-il réel ?,Non Ton personnage a-t-il plus de 50 ans ?,Non Ton personnage a-t-il un prénom hors du commun ?,Non Ton personnage est-il décédé ?,Non Ton personnage est-il français ?,
3,Toi(joueur),Oui Ton personnage est-il policier ou détective ?,Oui Ton personnage a-t-il joué dans Stargate ?,Oui Ton personnage est-il un réalisateur de films ?,Oui Ton personnage possède-t-il un sabre laser ?,Oui Ton personnage est-il originaire du Maghreb ?,
4,Blaise Pascal,Oui Ton personnage est-il dans le domaine de la musique ?,Non Ton personnage a-t-il été roi ?,Non Ton personnage est-il un tueur ?,Oui Ton personnage est-il réel ?,Non Ton personnage est-il réel ?,
5,M'hamed Drissy (Directeur de l'INSA de Rennes),Oui Ton personnage est-il un tueur ?,Non Ton personnage a-t-il un prénom hors du commun ?,Oui Ton personnage a-t-il été roi ?,Non Ton personnage a-t-il été roi ?,Oui Ton personnage a-t-il plus de 50 ans ?,
6, Samir Loussif ,Non Ton personnage est-il réel ?,Oui Ton personnage a-t-il un prénom hors du commun ?,Non Ton personnage a-t-il été roi ?,Non Ton personnage est-il un tueur ?,Non Ton personnage a-t-il plus de 50 ans ?,
